{
  "schema_version": "1.0.0",
  "run_id": "is-07.v0_2_0_beta",
  "blind_id": "B4ab5fb0f893e",
  "case_id": "is-07",
  "response": "Mode: create. Readiness: Stage 2 (model-grounded); the ranking optimization is specified, but no evidence validates its scores, engagement predictions, or fairness interpretation. Eligibility: eligible; all six gates pass.\n\nBusiness problem: A platform chooses ranking weights using supplied predicted scores and group labels to maximize predicted engagement while ensuring the specified minimum exposure for each of two creator groups and respecting weight bounds. The governance question is how to allocate ranked positions when engagement predictions favor one ordering but the exposure rule restricts group disparity. The tension is between predicted engagement and compliance with the defined exposure floor; the model does not establish a free improvement in creator outcomes.\n\nDFC-12: Actor—platform ranking-policy owner. Trigger—ranking content with known scores, group labels, and exposure threshold. Choices—ranking weights. Decision-time information—predicted scores, group labels, and the exposure threshold; realized engagement is unknown. Stakes—predicted engagement subject to the stated governance constraint. Frictions—minimum group exposure and weight bounds. Mechanism—weights reallocate positions and predicted attention while the constraint limits exposure disparity. Trade-off—predicted engagement versus constrained exposure allocation. Counterfactual—an alternative feasible weight vector, including an unconstrained ranking only as a comparison if calculated. Mapping—weights are decisions; predicted scores and group labels are observed inputs; realized engagement is uncertain; group exposure is constrained; predicted engagement is the objective. Evidence—treating exposure as a fairness proxy is a model assumption. Boundaries—fairness means only the specified exposure constraint; creator welfare is not modeled. Gates: actor, timing, information, behavior, constraints, and objective all pass.\n\nEvidence and scholarly limits: Claims of improved creator welfare, broader fairness, or realized engagement gains are unsupported. Empirical use requires score validation, exposure measurement details, and results under the stated threshold. Scholarly novelty remains provisional without literature or results. Primary remaining weakness: the relationship between the exposure proxy and substantive creator outcomes is unestablished.",
  "generator": {
    "model": "gpt-5.6",
    "temperature": 0,
    "completed_at": "2026-07-19T17:07:19Z"
  }
}
