{"schema_version":"1.0.0","run_id":"or-11.v0_2_0_beta","blind_id":"B1e3c50174ad0","case_id":"or-11","response":"**Mode: diagnose**\n\n**Readiness and eligibility.** Stage 2 (model-grounded), with one supplied computational fact: the strengthened formulation solved the supplied benchmark instances faster. The proposed direct profit story is **ineligible** because the behavior and objective gates fail: solver seconds are not profit and no causal pathway is given. The repaired computational frame passes all six fidelity gates.\n\n**Layer diagnosis.**\n\n- **Fidelity — fail in the profit story.** The equivalent formulation preserves production quantities, setups, inventories, feasible integer plans, and the setup/production/inventory cost objective. Runtime is a computational outcome, not an additional business objective.\n- **Managerial framing — fail until a pathway is specified.** Faster solving could matter through a binding planning deadline, reoptimization cadence, greater instance scale, or better incumbent at release, but none is supplied.\n- **Scholarly positioning — not assessed.** A methodological/computational contribution is plausible, but novelty relative to prior formulations and evidence beyond supplied benchmarks are missing.\n- **Evidence — mixed.** Faster solution on the supplied benchmarks is an empirical fact scoped to those tests. “Runtime improvement raises firm profit” is unsupported and needs a decision pathway plus profit evidence.\n- **Prose — fail where seconds saved are converted directly to profit.** Report runtime and cost-plan outcomes separately.\n\n**Repaired frame.** A production planner chooses setups, production quantities, and end-of-period inventory to meet demand within capacity and inventory-flow constraints while minimizing setup, production, and inventory cost. Valid inequalities tighten the relaxation and may reduce branch-and-bound search without changing the feasible plans or true optimum. The appropriate research question is whether the strengthened exact formulation improves computational performance on specified production-planning instances; its managerial value is conditional on that improvement changing a real planning action.\n\n**Boundaries.** The supplied benchmark result does not establish universal speed, a lower optimum than the equivalent model, realized profit, or value under an unspecified deadline. Hardware, solver, time limit, instance family, operational cadence, and profit pathway remain unknown. The primary remaining weakness is the absent link between benchmark runtime and an actual production-planning decision.","generator":{"model":"gpt-5.6","temperature":0,"completed_at":"2026-07-20T01:48:31Z"}}
