{
  "schema_version": "1.0.0",
  "run_id": "om-04.v0_1_0_alpha",
  "blind_id": "B3b787d08f644",
  "case_id": "om-04",
  "response": "## Business brief\n\nOnce per day, an online merchandising manager chooses one common set of at most eight products to display above the fold. The research problem is: which displayed set maximizes expected displayed-assortment margin given estimated visitor-choice probabilities and product margins? Including a product makes it eligible for choice but consumes one of eight scarce display slots, displacing another candidate. The choice is membership in the common daily set, not product ordering within the set or a visitor-specific display.\n\n## Decision-fidelity canvas and gates\n\nThe daily display deadline is the trigger. Choices are product-inclusion decisions subject to the eight-item cardinality constraint. The manager knows choice probabilities, margins, and the display limit before choosing; individual visitor preferences and purchases are realized later. The selected set defines the alternatives from which modeled visitors purchase or exit. A counterfactual is another feasible common set. The actor, timing, information, behavior, constraints, and objective gates all pass when there are no position effects, ranking decisions, or dynamic personalization.\n\n## Model mapping\n\n- Products displayed above the fold: binary inclusion decisions.\n- At most eight items: display-position constraint.\n- Estimated choice probabilities and margins: decision-time parameters.\n- Visitor preferences and choices: uncertainty and outcomes.\n- Expected displayed-assortment margin: objective.\n\n## Evidence and boundaries\n\nThe claim that eight items fit above the fold is a simplifying assumption and should be verified for the intended interface. The model does not support claims about optimal rankings, position effects, visitor-level targeting, dynamic adaptation, inventory, or fulfillment. It compares expected margin across common daily sets under the supplied probabilities; it does not guarantee realized margin. The main remaining weakness is whether the choice probabilities remain valid across alternative displayed sets in the actual interface.",
  "generator": {"model": "gpt-5.6", "temperature": 0, "completed_at": "2026-07-19T16:38:25Z"}
}
