{
  "schema_version": "1.0.0",
  "run_id": "om-03.v0_1_0_alpha",
  "blind_id": "Bba8c921f84b3",
  "case_id": "om-03",
  "response": "## Business brief\n\nBefore a selling period, a merchant allocates a shared inventory budget across two substitute products. The research problem is: how many initial units of each product should be stocked to maximize expected profit net of holding and shortage costs when joint demand is uncertain and a fixed modeled fraction of unmet requests for a stocked-out item switches to available inventory of the other item? Allocating more to one product protects its demand and possible redirected requests, but uses budget that could reduce shortage exposure for the other product and may create leftovers if its demand is low.\n\n## Decision-fidelity canvas and gates\n\nThe actor is the merchant and the trigger is the pre-period stocking deadline. Choices are initial units by product within the shared budget. Known inputs are the budget, unit economics, demand distribution, and assumed substitution fraction; realized demand, stockouts, and substitutions occur later. Inventory allocation interacts with demand to create stockouts, after which the assumed mechanism redirects a fraction of unmet requests if substitute stock is available. A counterfactual is another budget-feasible allocation. All six gates pass because allocation is ex ante, stockouts and substitutions remain outcomes, and the objective is expected profit net of the stated costs.\n\n## Model mapping\n\n- Initial units by product: decision.\n- Shared inventory budget: constraint.\n- Joint demand: random variable.\n- Stockout events and realized substitutions: outcomes.\n- Fixed substitution fraction: model parameter/assumption.\n- Expected net profit: objective.\n\n## Evidence and boundaries\n\nThe fixed substitution fraction is a model assumption, not causal evidence that a given stockout makes that fraction of customers switch. It requires estimation and stability checks for the intended products and period. The merchant does not select observed stockouts; they follow from allocation and realized demand. The model supports conditional expected-profit comparisons, not guaranteed realized profit or causal customer-behavior claims. The main remaining weakness is empirical validation of the joint demand and substitution assumptions.",
  "generator": {"model": "gpt-5.6", "temperature": 0, "completed_at": "2026-07-19T16:38:25Z"}
}
