{"schema_version":"1.0.0","run_id":"is-04.v0_1_0_alpha","blind_id":"Bf5357934d49f","case_id":"is-04","response":"# Diagnosis or brief\nMode: create. Domain: IS. Model supplied: yes. A platform selects one content-removal score threshold to minimize immediate expected classification loss from benign posts removed and harmful posts retained.\n\n# Proposed narrative\nBefore a post's latent class is known, the platform uses its classifier score to apply a common removal threshold. Because classification is imperfect, changing the threshold reallocates error: stricter removal can retain less harmful content but remove more benign content. The research problem is to choose the threshold that minimizes the supplied weighted loss, without treating that immediate objective as evidence about long-run community health.\n\n# Decision structure (DFC-12)\nActor: platform moderation-policy owner. Trigger: setting a score-based removal rule for user posts. Choices: one moderation threshold. Decision-time information: classifier score, estimated conditional score distributions, and loss weights; true class remains latent. Stakes: expected false-removal and harmful-retention loss. Frictions: one threshold and imperfect classification. Mechanism: the threshold converts noisy scores into removal outcomes. Trade-off: fewer harmful retentions versus more benign removals. Counterfactual: alternative feasible thresholds. Model mapping summary: threshold is decision; class is latent state; score is observation; removal is outcome; weighted loss is objective. Evidence status summary: community-health improvement is unsupported. Boundaries summary: immediate classification loss only.\n\n# Consistency gates\nActor—pass: the platform controls the threshold. Timing—pass: the rule uses information available at moderation. Information—pass: latent class is not treated as observed. Behavior—pass: errors follow threshold classification. Constraints—pass: one threshold is retained. Objective—pass: the narrative minimizes the modeled immediate loss. Eligible: true.\n\n# Model mapping\nmoderation score threshold | decision | common removal cutoff | chosen from supplied estimates | no individualized true-class rule\nlatent content class | state | benign or harmful status | unknown at decision | classification remains imperfect\nclassifier score | observation | noisy content signal | observed before removal | not verified harm\nremoval outcome | outcome | remove or retain | determined by score and threshold | may be erroneous\nexpected weighted loss | objective | false-removal plus harmful-retention loss | minimized in expectation | excludes long-run trust\n\n# Claims\nClassification is imperfect — model_assumption; source: null; retain as part of the supplied model. Moderation improves community health — unsupported_claim; source: null; verify with a suitable longitudinal or causal design, or remove.\n\n# Boundaries\nNo causal claim is made about trust, community health, user behavior, or long-run outcomes. Results depend on estimated score distributions and specified loss weights.\n\n# Most important remaining weakness\nThe loss weights and score distributions need validation in the intended moderation setting.\n\n# Mode result\nBusiness problem: Which single classifier-score threshold minimizes expected immediate loss from false removal of benign posts and retention of harmful posts under imperfect classification?","generator":{"model":"gpt-5.6","temperature":0,"completed_at":"2026-07-19T16:59:08.259Z"}}
