{"schema_version":"1.0.0","run_id":"om-13.v0_2_0_beta","blind_id":"Bc9c4eeeedb06","case_id":"om-13","response":"Mode: diagnose. Readiness: Stage 2 (model-grounded). Verdict: the proposed account is ineligible. The timing gate fails because it moves the initial allocation after weekend demand, and the information gate fails because it gives the depot realized zone demand that is unavailable when allocation occurs. The proposal also changes the feasible process by implying recourse despite the explicit no-transfer constraint. Actor and objective remain identifiable, but noncompensation requires repairing these failures before managerial framing.\n\nRequired repair: restore a single ex ante decision. Before the weekend, the depot divides fixed inventory among service zones using the joint demand distribution, shortage costs, and leftover costs. After demand realizes, positioned inventory determines each zone's shortage and leftover; no rebalancing is permitted. The structural tension is that protecting one zone against shortage uses stock that could cover another zone and can create leftovers if demand is low. A faithful question is which nonnegative advance allocation minimizes expected shortage and leftover cost. A demand-responsive redistribution policy would be a different, multistage model.\n\nModel mapping: zone allocations = pre-weekend decisions; total inventory, joint distribution, and cost coefficients = decision-time parameters; weekend demand = later random variable; shortages and leftovers = outcomes; fixed stock, nonnegativity, and no transfers = constraints; expected shortage-plus-leftover cost = objective. Units and weekend subperiod detail are unspecified.\n\nEvidence and boundaries: the joint distribution representing weekend demand is a model assumption, not verified forecast accuracy. The model does not establish benefits of post-demand rebalancing or any realized cost reduction. Literature and empirical significance are not supplied, so scholarly positioning is not assessed. Primary remaining weakness: demand-distribution calibration and operational evidence are absent.","generator":{"model":"gpt-5.6","temperature":0,"completed_at":"2026-07-19T16:47:23Z"}}
