{"schema_version":"1.0.0","run_id":"or-01.v0_2_0_beta","blind_id":"Bee2878f2ce38","case_id":"or-01","response":"**Mode: diagnose**\n\n**Readiness and eligibility.** Stage 2 (model-grounded): the network-design decisions, constraints, objective, formulation relationship, and tightening mechanism are supplied. A frame that treats the contribution as computational passes all six gates and is **eligible**. Any claim that the stronger formulation yields a lower-cost plan than the true optimum would be ineligible because the formulations have the same feasible integer set and objective.\n\n**Layer diagnosis.**\n\n- **Fidelity — pass in the repaired frame.** Facility openings and shipment flows remain the business decisions. Valid inequalities tighten the linear relaxation and may reduce branch-and-bound search without changing the optimization problem or optimum.\n- **Managerial framing — not assessed for realized value.** The plausible pathway is that improved solve performance could make larger instances, more alternatives, or tighter decision deadlines tractable, but no deadline, scale threshold, or changed operational action is supplied.\n- **Scholarly positioning — not assessed.** The potential contribution is methodological/computational—an equivalent stronger exact formulation—but novelty relative to prior formulations and comparative results are absent.\n- **Evidence — fail for “solves instances faster.”** This is an inference requiring tests on stated instance families, hardware, solver, limits, and metrics.\n- **Prose — pass when “stronger” describes the relaxation rather than the operational plan.**\n\n**Concrete business-research problem.** A network planner chooses facility openings and shipment flows to satisfy demand within facility capacity and network-flow constraints while minimizing fixed opening and routing cost. The research asks whether valid inequalities can strengthen the exact MILP so the same optimal network-design problem can be solved or certified more effectively. The business relevance is conditional: computational improvement matters only if it changes what the planner can solve before a real decision deadline or at a relevant scale.\n\n**Model map and boundaries.** Openings and flows are decisions; network data, costs, capacities, and demands are fixed inputs; valid inequalities are formulation components; bounds, search effort, runtime, and certificates are computational outcomes. The model does not establish lower operational cost beyond the common optimum, universal speed, or realized firm performance. The primary remaining weakness is missing controlled computational evidence and an explicit operational pathway from solve performance to a planning action.","generator":{"model":"gpt-5.6","temperature":0,"completed_at":"2026-07-20T01:48:31Z"}}
