{
  "schema_version": "1.0.0",
  "run_id": "om-05.v0_1_0_alpha",
  "blind_id": "B85064fa603da",
  "case_id": "om-05",
  "response": "## Business brief\n\nA central-depot inventory planner must allocate a fixed stock across fulfillment zones before regional orders arrive. The research problem is: how should the planner pre-position units to minimize expected shortage and holding cost when regional demands may be correlated and stock cannot be transferred after demand is observed? Concentrating stock can protect against high demand in selected zones but exposes other zones to lost sales; spreading stock broadens coverage but can leave mismatched leftovers because pooling through later transfers is infeasible.\n\n## Decision-fidelity canvas and gates\n\nThe trigger is the single-period allocation deadline. The choices are nonnegative units assigned to each zone, summing to the fixed stock. At that time the planner knows total stock, regional demand distributions, and cost coefficients, but not realized regional demand. Stakes are expected shortage and holding costs. The mechanism is that the ex ante allocation caps what each zone can serve after demand realizes; shortages, leftovers, and lost sales are outcomes rather than choices. The counterfactual is another feasible allocation of the same stock. The actor, timing, information, behavior, constraints, and objective gates all pass because the depot controls allocation, uses distributions rather than future demand, has no recourse, and retains the stated expected-cost objective.\n\n## Model mapping\n\n- Units by zone: decision, chosen before demand.\n- Regional demand: correlated random variable, realized later.\n- Fixed total stock and no-transfer rule: constraints.\n- Leftovers and lost sales: post-demand outcomes.\n- Expected shortage plus holding cost: objective, not a guarantee about realized cost.\n\n## Evidence and boundaries\n\nThe correlation of regional demand is a model assumption supplied by the case, not an empirical fact. No evidence is supplied that a particular depot faces these distributions or costs; those inputs would require calibration for deployment. The model excludes post-demand transfers and therefore supports no claim about dynamic rebalancing, recovered lost sales, or performance under recourse. Its result is an ex ante allocation recommendation under the assumed joint distribution, not observed cost savings. The main remaining weakness is whether the assumed regional demand distribution and cost coefficients represent the intended operating setting.",
  "generator": {"model": "gpt-5.6", "temperature": 0, "completed_at": "2026-07-19T16:38:25Z"}
}
