{"schema_version":"1.0.0","run_id":"or-13.v0_2_0_beta","blind_id":"B5e31d4749b3a","case_id":"or-13","response":"**Mode: diagnose**\n\n**Readiness and eligibility.** Stage 2 (model-grounded): the routing decisions, objective, constraints, solver mechanism, and 08:00 release deadline are specified. The proposed story is **ineligible** because its timing and behavior gates fail: a certificate issued at 08:30 cannot alter routes already released and executed at 08:00. The repaired interpretation passes all six gates.\n\n**Layer diagnosis.**\n\n- **Fidelity — fail in the proposed story.** It gives a post-decision proof a retroactive operational effect. Repair: separate the quality of the feasible incumbent available by 08:00 from the proof of model optimality obtained at 08:30.\n- **Managerial framing — fail until repaired.** The operational question is which feasible vehicle routes and service times to release by 08:00, given capacity and time windows, while minimizing monetary routing and lateness cost. The structural tension is solution improvement versus decision latency.\n- **Scholarly positioning — not assessed.** No literature, method comparison, or novelty evidence is supplied; any claim about a contribution in deadline-aware exact optimization remains provisional.\n- **Evidence — fail for the claim that certificates are routinely available before release.** That practice claim needs operational timing data. The 08:30 gap closure is only a supplied case fact.\n- **Prose — fail in the suggested story.** Remove “the certificate improves the executed morning routes.”\n\n**Repaired frame.** An exact solver searches over capacity- and time-window-feasible routes. At 08:00, the planner must release the best feasible incumbent then available; that incumbent determines the executed routes and their modeled monetary routing and lateness cost. Continued search may close the optimality gap at 08:30, establishing retrospectively that no better route plan existed under the model, but it cannot improve the departed vehicles’ routes. The later certificate may support ex post evaluation only if such an evaluation is an actual decision pathway.\n\n**Model map and boundaries.** Vehicle routes and customer service times are decisions; solver incumbents and bounds are computational outputs; gap closure is a certificate, not a routing action. The analysis does not establish that pre-deadline incumbents are optimal, that certificates normally arrive before 08:00, or that the post-deadline proof changes approval, learning, or future dispatch decisions. The primary remaining weakness is the missing operational pathway through which certification has value after release.","generator":{"model":"gpt-5.6","temperature":0,"completed_at":"2026-07-20T01:48:31Z"}}
