{"schema_version":"1.0.0","run_id":"or-12.v0_1_0_alpha","blind_id":"B6e8b61b42f21","case_id":"or-12","response":"## Diagnosis\n\n**Mode:** diagnose | **Domain:** OR | **Verdict:** ineligible as proposed\n\nThe narrative commits a state-as-decision error: the planner does not choose machine availability. The faithful problem has two decisions. Before failures are known, the planner assigns jobs using jobs, eligibility, capacities, costs, and a failure-scenario distribution. After exogenous machine availability is observed, the planner may make only the scenario-feasible reassignments permitted by the reassignment limit, leaving some jobs uncompleted if necessary.\n\n**DFC-12:** Actor—operations planner. Trigger—jobs must be positioned before next-day machine failures resolve. Choices—first-stage assignments and limited second-stage reassignments. Decision-time information—stage one knows the scenario distribution, not realized availability; stage two observes realized availability. Stakes—advance-assignment, recourse, and uncompleted-job cost. Frictions—capacity, eligibility, and scenario-specific reassignment limits. Mechanism—advance positioning hedges failures; recourse responds after availability is observed. Trade-off—advance positioning cost versus later recourse and uncompleted-job exposure. Counterfactual—advance assignments with no or a different recourse policy. Model mapping—availability is an exogenous state, not a decision. Evidence status—the scenario distribution is a model assumption. Boundaries—only modeled scenarios and recourse rules are covered.\n\n**Consistency gates:** Actor—fail in the proposed story because the planner is assigned control of exogenous availability. Timing—pass only after restoring advance assignment before realization and recourse after it. Information—fail in any version that lets stage one use realized failures. Behavior—pass after using the stated two-stage response. Constraints—pass if the reassignment limit, capacity, and eligibility remain explicit. Objective—pass if all three stated cost components are retained.\n\n**Model mapping:** `first-stage job assignments` → decision, chosen before availability; `realized machine availability` → random state, observed only before recourse; `second-stage feasible reassignments` → decision conditional on the observed scenario; `uncompleted jobs` → outcome/state; constraints and total expected cost retain their stated roles.\n\n**Claims:** [model assumption] failure scenarios represent next-day availability; no source is supplied, so state and test this assumption rather than presenting it as fact. [unsupported claim] external validity of the scenario distribution; calibrate and validate before deployment.\n\n**Boundary conditions:** availability is never chosen; recourse is limited; stage-one plans cannot use realized failures; no performance claim beyond the supplied model. **Primary remaining weakness:** the representativeness of the failure distribution is unvalidated.\n\n**Mode result:** `failed_gates`: actor and information in the proposed narrative. `repairs`: replace “choose available machines” with “observe exogenous availability,” restore first-stage assignments before realization, and allow only constrained second-stage reassignment; these are fidelity corrections, not model extensions.","generator":{"model":"gpt-5.6","temperature":0,"completed_at":"2026-07-19T17:19:32Z"}}
