{
  "schema_version": "1.0.0",
  "run_id": "om-11.no_skill",
  "blind_id": "Ba1729816b0d3",
  "case_id": "om-11",
  "response": "The proposed story changes the model's mechanism. The actual decision is which products to offer in one focal store, subject to that store's assortment capacity, before customer demand is realized. An unavailable product triggers a modeled transition among alternative products within the same store until the customer purchases an offered item or exits. These uncertain starting states, transition paths, and outcomes determine expected store revenue, but the retailer controls only assortment membership, not any customer's realized path. The estimated transition matrix represents within-store substitution as a model assumption. It contains no competitor locations, travel behavior, search process, or store-choice decision. Consequently, the claim that customers visit the nearest competing store after encountering an unavailable item is unsupported and cannot explain this formulation. Studying that behavior would require additional evidence and a different model that explicitly represents competitor search and location choice.",
  "generator": {
    "model": "gpt-5.6",
    "temperature": 0,
    "completed_at": "2026-07-19T16:31:26Z"
  }
}
