{"schema_version":"1.0.0","run_id":"or-14.v0_1_0_alpha","blind_id":"B746809056f83","case_id":"or-14","response":"## Diagnosis\n\n**Mode:** diagnose | **Domain:** OR | **Verdict:** eligible as a bounded computational comparison; managerial superiority unsupported\n\nA maintenance-routing planner selects technician routes and jobs to serve, subject to technician capacity, eligibility, and route continuity, minimizing travel plus missed-service penalty. A heuristic emphasizes rapid feasibility; an exact method continues searching for better incumbents and a bound that may eventually certify optimality. Because no route-release deadline, replanning cadence, instance scale, acceptable gap, or certificate-triggered action is supplied, neither method can yet be declared managerially superior.\n\n**DFC-12:** Actor - maintenance-routing planner. Trigger - a set of jobs requires a service plan. Choices - technician routes and jobs selected for service. Decision-time information - jobs, travel times, capacities, eligibility, and cost/penalty weights. Stakes - travel plus missed-service penalty. Frictions - capacity, eligibility, continuity, and computation time. Mechanism - the heuristic constructs feasible routes rapidly; the exact method improves incumbents and bounds. Trade-off - early feasibility versus potential quality improvement and certification. Counterfactual - the two methods on the same model, instances, and budget. Model mapping - business decisions and objective are identical; runtime, gap, and certificate are computational outcomes. Evidence status - both claimed operational pathways are unsupported. Boundaries - no automatic field-performance or universal exactness value.\n\n**Consistency gates:** Actor - pass. Timing - pass at model level, but managerial value requires a specified release time. Information - pass. Behavior - pass. Constraints - pass if both methods use the same feasible set. Objective - pass if both use the same travel and missed-service objective.\n\n**Model mapping:** `technician routes/jobs selected` -> decisions; jobs/travel/capacity/eligibility/weights -> observed inputs; rules -> constraints; `heuristic incumbent` -> feasible outcome without bound; `exact incumbent/bound/gap/certificate` -> computational outcomes.\n\n**Claims:** [unsupported claim] early feasibility is operationally valuable; document the release deadline or replanning cadence and the action enabled. [unsupported claim] a certificate changes approval or escalation; identify that decision and its tolerance. [unsupported claim] a faster heuristic improves field performance; this requires an explicit route-to-field outcome link.\n\n**Boundary conditions:** same feasible set and objective; comparisons require matched instances, hardware, settings, and time budgets; exactness does not imply timely certification; heuristic speed does not imply better execution. **Primary remaining weakness:** the operational decision pathway is unspecified.\n\n**Mode result:** `failed_gates`: none for a same-model computational comparison. `repairs`: remove any assertion that either method is managerially superior; specify the route-release deadline or cadence, relevant scale, acceptable gap, and the decision changed by a certificate before drawing an operational ranking. These are evidence and pathway requirements, not changes to the routing model.","generator":{"model":"gpt-5.6","temperature":0,"completed_at":"2026-07-19T17:19:32Z"}}
