{"schema_version":"1.0.0","run_id":"or-03.v0_2_0_beta","blind_id":"B222518e9173f","case_id":"or-03","response":"**Mode: diagnose**\n\n**Readiness and eligibility.** Stage 2 (model-grounded): the cutoff information set, batching and routing decisions, distance objective, mechanism, and constraints are supplied. The frame below passes all six gates and is **eligible**. Empirical operating effects beyond distance are outside the supplied evidence.\n\n**Layer diagnosis.**\n\n- **Fidelity — pass.** At the cutoff, the planner optimizes only released orders with known item locations. Orders are assigned once to capacity-feasible batches, and picker routes satisfy continuity. The objective is total travel distance.\n- **Managerial framing — pass, conditionally.** The warehouse planner asks how to form batches and routes jointly because batch composition determines which locations can be visited on one route. Larger combined batches may consolidate travel but are constrained by cart capacity and order assignment.\n- **Scholarly positioning — not assessed.** No literature, algorithmic novelty, comparison, or results are supplied, so a paper-level contribution cannot be asserted.\n- **Evidence — pass with qualification.** Lower walking distance may indicate lower operating burden, but that is an inference rather than a measured labor, time, or cost effect.\n- **Prose — pass when congestion, later arrivals, and learning are stated as exclusions rather than mechanisms.**\n\n**Concrete business-research problem.** At an order cutoff, a warehouse planner jointly assigns all released orders to batches and routes pickers through known item locations. Each order must appear in one batch, carts cannot exceed capacity, and routes must be continuous. The research question is how joint batching and routing can minimize total picker travel distance relative to feasible sequential or other benchmark policies. The mechanism is combinatorial: changing batch composition changes the set of locations visited together and hence route distance.\n\n**Model map and boundaries.** Batch assignments and routes are decisions; released orders, item locations, and cart capacity are decision-time inputs; total travel distance is the modeled outcome. The model is deterministic for orders known at cutoff. It does not include congestion, arrivals after cutoff, picker learning, or direct labor/time/cost measurement; therefore it cannot claim effects through those mechanisms. Units and planning horizon are otherwise unspecified. The primary remaining weakness is the unverified link from reduced distance to the operational outcome managers ultimately value.","generator":{"model":"gpt-5.6","temperature":0,"completed_at":"2026-07-20T01:48:31Z"}}
