{"schema_version":"1.0.0","run_id":"or-06.v0_2_0_beta","blind_id":"B99f500e921e9","case_id":"or-06","response":"**Mode: diagnose**\n\n**Readiness and eligibility.** Stage 2 (model-grounded): assignments, sequences, feasibility, makespan objective, branch-and-bound mechanism, and time-contingent certificate semantics are supplied. The qualified frame below passes all six fidelity gates and is **eligible**. Certification by an operational deadline is not established.\n\n**Layer diagnosis.**\n\n- **Fidelity — pass.** The planner chooses job-to-machine assignments and sequences subject to eligibility, one assignment per job, and nonoverlap. A feasible incumbent is a usable schedule; it is proven optimal only when the incumbent and bound meet.\n- **Managerial framing — not assessed for deadline value.** The decision is to minimize maximum completion time. A smaller incumbent makespan and a smaller optimality gap are distinct outputs; the value of waiting for proof depends on an unspecified release deadline or approval rule.\n- **Scholarly positioning — not assessed.** No literature, algorithmic novelty, comparative performance, or results are supplied.\n- **Evidence — fail for “operational deadlines permit certification.”** That claim requires runtime distributions under specified instances, hardware, solver settings, and actual deadlines.\n- **Prose — pass when “exact” is tied to termination with gap closure, not to every returned schedule.**\n\n**Concrete business-research problem.** A scheduling planner assigns eligible jobs to parallel machines and sequences them without overlap to minimize the maximum completion time. Branch-and-bound searches for improved feasible schedules while producing a bound. If the incumbent and bound meet before release, the resulting certificate proves that no better schedule exists under the model. If computation stops earlier, the planner has a feasible schedule and an optimality gap, not proof of optimality. The structural tension is schedule improvement and confidence versus decision latency.\n\n**Model map and boundaries.** Assignments and sequences are decisions; jobs, processing times, and eligibility are inputs; makespan is the objective outcome; incumbent, bound, gap, and certificate are computational outputs. Solver runtime is uncertain. The analysis does not promise certification under every time limit, equate feasibility with optimality, or show what operational action a certificate changes. The primary remaining weakness is missing evidence about solve-time behavior relative to the actual schedule-release deadline.","generator":{"model":"gpt-5.6","temperature":0,"completed_at":"2026-07-20T01:48:31Z"}}
