{"schema_version":"1.0.0","run_id":"or-10.v0_1_0_alpha","blind_id":"B826f1d147e97","case_id":"or-10","response":"## Business brief\n\n**Mode:** create | **Domain:** OR | **Eligible:** yes\n\nA crew scheduler must assign available crew to shifts, using known costs and rest rules, so that coverage is achieved at low staffing and uncovered-shift penalty. Priority rules can rapidly construct a feasible schedule; they supply neither a bound nor an optimality certificate. The research problem is: when a schedule is needed under a planning deadline, how useful is rapid feasible construction, measured by feasibility, objective value, and runtime on the stated instances, without representing the heuristic as optimal?\n\n**DFC-12:** Actor—crew scheduler. Trigger—a set of shifts requires staffing. Choices—crew-to-shift assignments. Decision-time information—shifts, availability, costs, and rest rules; no uncertainty is modeled. Stakes—staffing cost plus uncovered-shift penalty. Frictions—coverage, availability, and rest-rule constraints. Mechanism—priority rules construct assignments rapidly. Trade-off—earlier feasibility versus potentially better objective values available from more search. Counterfactual—a stated reference method or incumbent policy, currently unspecified. Model mapping—assignments are decisions; inputs are observed parameters; rules are constraints; total cost and uncovered-shift penalty form the objective. Evidence status—performance is supported only on a small synthetic test set; meeting real deadlines is unsupported. Boundaries—no optimality or live-operations generalization.\n\n**Consistency gates:** Actor—pass, the scheduler controls assignments. Timing—pass, all listed inputs precede construction. Information—pass, no future fact is used. Behavior—pass, only the stated priority-rule mechanism is claimed. Constraints—pass, coverage, rest, and availability are retained. Objective—pass, the frame preserves staffing and uncovered-shift penalty.\n\n**Model mapping:** `crew-to-shift assignments` → decision, chosen at planning time; `availability/costs` → observed parameters; `coverage/rest/availability` → constraints; `priority rules` → algorithmic mechanism producing a feasible solution, not a certificate; `objective value` → outcome/derived quantity.\n\n**Claims:** [model assumption] the deterministic inputs describe the planning instance; verify for application. [empirical fact] the heuristic performed well only on the supplied small synthetic tests; retain that scope. [unsupported claim] the method meets real planning deadlines; obtain the actual deadline, hardware, solver/comparator, instance sizes, time limits, and repeated results before claiming this.\n\n**Boundary conditions:** synthetic instances only; no uncertainty; no bound, gap, or optimality guarantee; operational value depends on a documented release deadline and benchmark context. **Primary remaining weakness:** there is no evidence linking observed synthetic runtime to a real planning deadline.\n\n**Mode result — business problem:** Evaluate whether the constructive heuristic delivers feasible, low-penalty crew schedules within a specified planning deadline, while reporting objective values and runtime only for tested instances and never labeling its output optimal.","generator":{"model":"gpt-5.6","temperature":0,"completed_at":"2026-07-19T17:19:32Z"}}
