{"schema_version":"1.0.0","run_id":"or-08.v0_1_0_alpha","blind_id":"B49e75031c2db","case_id":"or-08","response":"## Diagnosis\n\n**Mode:** diagnose | **Domain:** OR | **Verdict:** ineligible as proposed\n\nThe planner cannot choose next week’s regional demand. Demand is an exogenous random state drawn after the planner commits scarce supply across regions. The faithful managerial problem is to choose nonnegative advance allocations within total supply so as to maximize expected served-demand value under the supplied demand distribution.\n\n**DFC-12:** Actor—regional allocation planner. Trigger—fixed supply must be positioned before next-week demand is known. Choices—advance regional allocations only. Decision-time information—total supply, demand distribution, and service values; realized demand remains unknown. Stakes—expected served-demand value. Frictions—total supply and nonnegativity. Mechanism—allocations set regional service capacity; exogenous demand realizations determine served demand. Trade-off—capacity sent to one region cannot serve another, while marginal expected service values differ. Counterfactual—a different feasible allocation policy. Model mapping—allocation is the decision; demand is a random state; served demand is an outcome. Evidence status—the demand distribution is an assumption. Boundaries—no demand control or perfect foresight.\n\n**Consistency gates:** Actor—fail in the proposed story because demand is not controlled by the planner. Timing—fail if allocation occurs after demand; pass only with allocation first. Information—fail if realized demand is treated as observed at allocation time. Behavior—pass after restoring exogenous demand. Constraints—pass when total supply and nonnegativity remain explicit. Objective—pass when expected served-demand value is retained.\n\n**Model mapping:** `advance regional allocations` → decision, chosen before demand; `next-week regional demand` → random state, realized later; `served demand` → outcome determined by allocation and demand; `demand distribution/service values` → decision-time parameters; `total supply` → constraint.\n\n**Claims:** [model assumption] regional demand follows the supplied distribution; retain as an assumption and validate if the setting is applied. [unsupported claim] the planner can influence or observe demand when allocating; remove.\n\n**Boundary conditions:** the model optimizes expected value, not every realized week; demand is exogenous; the frame includes no recourse after demand. **Primary remaining weakness:** no evidence is supplied that the assumed distribution represents future regional demand.\n\n**Mode result:** `failed_gates`: actor, timing, and information in the proposed narrative. `repairs`: remove demand from the choice set, place allocation before demand realization, and describe served demand as the resulting state-dependent outcome.","generator":{"model":"gpt-5.6","temperature":0,"completed_at":"2026-07-19T17:19:32Z"}}
