{"schema_version":"1.0.0","run_id":"om-11.v0_2_0_beta","blind_id":"B222bbaa1fa62","case_id":"om-11","response":"Mode: diagnose. Readiness: Stage 2 (model-grounded). Verdict: the proposed nearest-competitor story is ineligible. The behavior gate fails because the mathematical mechanism contains only transitions among alternatives in the focal store followed by purchase or exit; it has no competitor search, distance, location choice, or inter-store transition. Actor, timing, information, constraints, and objective otherwise match a retailer choosing one store's assortment before demand using revenues, capacity, and an estimated within-store matrix. Managerial and scholarly polishing cannot repair this mechanism failure.\n\nRequired repair: remove the claim that an unavailable item sends the customer to the nearest competing store. Frame the decision as selecting products for the focal store under assortment capacity. Under the model assumption, an unavailable preferred product triggers within-store substitution until an offered product is purchased or the customer exits. The retailer controls the offered set, not the realized starting state or transition path. Adding store search would be a declared model extension requiring competitor alternatives, locations, search behavior, parameters, and a revised choice mechanism.\n\nFaithful mapping: offered products = pre-demand decisions; product revenues, capacity, and the estimated within-store transition matrix = decision-time parameters; starting state and within-store path = uncertain states; purchase or exit = outcome; focal-store capacity = constraint; expected store revenue = objective. Units and horizon are unspecified.\n\nEvidence and boundaries: within-store substitution is a model assumption. The nearest-store claim is unsupported and prohibited; it needs evidence but, more importantly, a different model before it can enter this narrative. No literature is supplied, so novelty and contribution claims remain not assessed. Primary remaining weakness: empirical validity of the within-store transition matrix is not established.","generator":{"model":"gpt-5.6","temperature":0,"completed_at":"2026-07-19T16:47:23Z"}}
