{
  "schema_version": "1.0.0",
  "run_id": "om-07.v0_1_0_alpha",
  "blind_id": "B72d6bbf596d1",
  "case_id": "om-07",
  "response": "## Business brief\n\nBefore a short selling season begins, a buyer must place one nonnegative integer order for a seasonal product without observing the season's demand. The research problem is: what budget-feasible preseason quantity maximizes expected profit given the demand distribution, purchase and selling prices, salvage value, and the absence of later replenishment or recovery of lost sales? A larger order preserves margin when demand is high but risks leftovers sold at salvage value when demand is low; a smaller order limits overage but sacrifices margin on unmet demand.\n\n## Decision-fidelity canvas and gates\n\nThe preorder deadline is the trigger and the order quantity is the only choice. At that moment, the buyer observes the demand distribution and economic parameters, not realized seasonal demand. The fixed quantity interacts with later demand to produce sales, leftovers, and lost sales. The budget ceiling and integer nonnegativity define feasibility; the counterfactual is another feasible one-shot quantity. The actor, timing, information, behavior, constraints, and objective gates all pass because the buyer controls the preorder, realized demand remains unknown, there is no recourse, and the objective is expected profit.\n\n## Model mapping\n\n- Preseason order quantity: ex ante decision.\n- Demand distribution and prices: decision-time parameters.\n- Seasonal demand: random variable realized later.\n- Budget and integer nonnegativity: constraints.\n- Leftovers and lost sales: outcomes.\n- Expected profit: objective, not guaranteed realized profit.\n\n## Evidence and boundaries\n\nCalibration of the demand distribution is a model assumption in the supplied material, not an established empirical fact. Deployment requires evidence that it represents the intended product and season and that the price and salvage inputs are accurate. The model excludes replenishment, backlogging, and later recovery of unmet demand; it should not be used to claim performance when those features apply. The main remaining weakness is the unverified demand calibration for the target season.",
  "generator": {"model": "gpt-5.6", "temperature": 0, "completed_at": "2026-07-19T16:38:25Z"}
}
