{"schema_version":"1.0.0","run_id":"or-04.no_skill","blind_id":"B8ca1de9a44be","case_id":"or-04","response":"The business-research problem is how a service network should reserve regional capacity before uncertain demand and use limited corrective capacity afterward. In the first stage, using the scenario distribution, costs, and available advance capacity, the planner chooses regional reservations subject to the reservation budget; these decisions cannot use realized demand. Regional demand is then observed as an exogenous state. In the second stage, the planner allocates a limited recourse pool across regions, subject to scenario-specific recourse capacity and flow balance. The objective is to minimize reservation, recourse, and unmet-demand cost. The mechanism is a trade-off between hedging imbalances in advance and correcting them later at extra cost. A faithful study can test how reservation and recourse policies perform across the specified scenarios. The representation of future regional demand by the supplied scenario probabilities is a modeling assumption, not an established fact, and requires calibration or validation before results are generalized.","generator":{"model":"gpt-5.6","temperature":0,"completed_at":"2026-07-19T17:13:50Z"}}
